{
  "ldf_version": "2.0.0",
  "document_id": "00000000-0000-0000-0000-000000000002",
  "created_at": "2026-10-12T20:00:00Z",
  "source_image": {
    "filename": "pagina_ficticia.jpg",
    "width": 1200,
    "height": 1600,
    "sha256": "4b227777d4dd1fc61c6f884f48641d02b4d121d3fd328cb08b5531fcacdabf8a"
  },
  "coordinate_space": {
    "frame": "source_image",
    "unit": "pixel"
  },
  "pipeline": {
    "stages": {
      "layout": {
        "status": "not_run"
      },
      "reading_order": {
        "status": "not_run"
      },
      "recognition": {
        "status": "not_run"
      },
      "semantics": {
        "status": "not_run"
      },
      "diagrams": {
        "status": "not_run"
      }
    }
  },
  "recognition": {
    "lines": []
  },
  "structure": {
    "regions": [],
    "reading_order": [],
    "diagrams": []
  },
  "human_corrections": []
}
